{
  "from": "/tmp/orchestra_workspaces_prev",
  "to": "/tmp/orchestra_workspaces",
  "dry_run": true,
  "result": {
    "applied": false,
    "actions": [
      {
        "type": "move_entry",
        "source": "/tmp/orchestra_workspaces_prev/MT-1",
        "target": "/tmp/orchestra_workspaces/MT-1"
      }
    ]
  }
}
